<?xml version="1.0" encoding="UTF-8"?>
<!DOCTYPE Clientes SYSTEM "Clientes_avanzado.dtd">
<Clientes>
    <sede codigo ="A7492597">
        <direcciones>
            <direccion>El Prado NÂº39</direccion>
            <direccion> </direccion>
        </direcciones>
        <empleado id="1">
            <nombre>Pepito</nombre>
            <apellido>Perez</apellido>
        </empleado>   
        <fecha_alta>2023-04-07</fecha_alta>
        <cliente codigo="ABC-743">
            <descripcion_cliente>solvente</descripcion_cliente>
            <numero_viv>2</numero_viv> 
            <vivienda id="001"> 
                <coste>1000,25</coste>
                <resumen>Se encuentra en buenas condiciones</resumen>
                <plazo>30</plazo>   
            </vivienda>
        </cliente>
    </sede>
</Clientes>